Zaman damgası,Ders Seç,İsmin Nasıl Gözüksün,Ders hakkındaki yorumun
25.01.2026 21:58:14,İşletim Sistemleri,Semaphore,"Sizleri bölümün en büyük hayal kırıklığıyla tanıştırayım. Özellikle ZCT'den alıyorsanız şimdiden boşa gidecek 15 haftanız hayırlı olsun. Derste tek bir şey bile öğrenmemeniz için çaba sarfeden bir hoca, bölümde yapılan tartışmasız en kötü vize, en kötü vize2, en kötü final, en kötü sınav formatı. Çoktan çok seçmeli, yanlış doğruyu götürmeli, ""sınavlar"". AA'yı 60 lara indirebilen tek ders. Diyecek söz bulamıyorum. Bu kadar önemli ve teknik bir ders niye bu kadar kötü yönetiliyor?
Slaytları hatim etmezseniz hocanın da tabiriyle sıfıra soldan yaklaşırsınız. Günlerce çalışsanız da çok bir şey değişmiyor, aynı notları alıyorsunuz. Soruların çoğu ne ezbere ne mantığa dayalı, çağ açan bir buluş her biri. Öyle bir sınav ki soru dağılımını Paging algoritması yapsak çalıştığınız konuların yarısını kağıtta ararken Page Fault yersiniz. Senkronizasyon sorularında şıklar E.W.Dijkstra'yı mezarında ters döndürür. Arkadaşlarınızla sınav çıkışı karşılaştırdığınız işaretlemeleri C'de rastgele sayı üreteci olarak kullanıp system call ile kernele gönderebilirsiniz.
Hala anlaşılmadıysa, kendi iyiliğiniz için, ZCT'den ders almayın. Hocadan dersi anlatmasını beklersiniz, hoca sizden bekler, Deadlock oluşur. 2 saatte slaytın 1 konusuna değinip durur, kalanını siz okuyun der, haftaya yine eski konuyu öğrenciye sorar, aradaki konular asla critical sectiona giremez. Starvation oluşur. 
Kısaca İşletim Sistemlerine olan sevgimi köküne kadar kurutan bu derse, slaytlara, meşhur dinozor kitabına, bir daha asla görmek istemediğim ZCT'ye ve beni bu sınav formatına olan ısrarıyla çok şaşırtan, ders seçiminde dolduğu için alamadığım diğer hocaya içten.. teşekkür bildiren interruptlarımı yolluyorum.
İşletim Sistemlerine ilginiz varsa tavsiyem dersten bağımsız OSTEP adlı kitabı okumanız, derstekinden daha güncel, daha somut, ders dışına katkısı haricinde belki hocaların sarhoşken hazırladığını düşünmenize sebep olacak sınav sorularına da katkısı olur. Ha lafı gelmişken sınavlar için uygulama slaytlarının sorularını da ezberlemeniz lazım, hatta yeterince psikopatsanız verilen Red Hat kursu sorularını da tek tek ezberleyin. Finalde puanınız düşsün diye birkaç tane koyuyorlar."
25.01.2026 22:01:24,Bilgisayar Bilimlerine Giriş,Hakiki,Önceden hafif bir altyapınız varsa hiç de dendiği kadar zor değil. Fizik ve Mat1 sizi daha çok zorlar bu derse göre. Ancak okula sıfır olarak geliyorsanız mutlaka çalışmalısınız. Hocalar da bölüm sitesinde yazanın aksine sıfırdan gelenlere göre anlatmıyorlar bence. Bu durum mutlaka düzeltilmeli.
25.01.2026 22:03:48,Matematik 1,Hakiki,Fatma Çeliker'den alırsanız dönemin en zevkli dersi olacaktır. Kraliçe!
25.01.2026 22:53:06,Mikroişlemci Sistemleri ve Assembly Dili,InstructionPointer,"Ödev videonuz 4dkyı geçerse idam ediliyorsunuz.
Derste 7 hafta 8086 assembly dili, 7 hafta 8086 mikroişlemci ve çevre birimleri işleniyor. Dersler ayrıkken işlenen bazı konular kırpılıyor, Mikro konuları genellikle hafta hafta birbirinden ayrılmış ve her hafta verilen lablar için ders örnekleri ile işleniyor. Bu arada 4dk ya dikkat edin.
Tabiki bölümdeki her donanım dersi gibi yormayı seven bir müfredatı var, haftasonuna verilen, KATILIMI ZORUNLU 8 LAB(ödev) VE 2 ÖDEV(büyük ödev) üstüne sözlüler ve iki ağır dersin ziplenmiş müfredatı ile ruhunuzu emicek bir ders gibi duruyor. 4dk içinde kod ve devrenizi de anlatmanız lazım. 
Ama neyse ki özellikle mikro ödevlerinin çoğu zor değil, dersi dinleyip, örnekleri inceleyip yapay zekadan yardım alarak yapamayacağınız ödev yok. Bazı aşırı zor olduğu için ödevin SON GÜNÜ ödeve seçenek eklenip asıl istenileni yapanlara 0.3 puancık ekledikleri 3. assembly labı istisna tabiki.
4dk da 500 satır kod mu anlatılır?
Ödev ve Labların ortalamaya toplam katkısı %40 olduğundan dersi geçmek çok kolay. Tabiki yeni yönerge yüzünden(final<40 -> FF) finali batırmamanız lazım. Bir de harf notunu bu derste hocalar ağrı dağına çıkarmayı çok seviyor, ödev ve lab ortalamalarının aşırı yüksek olması da sebeplerinden biri. Sınavlara iyi çalışın. Vize ve finalde assembly kısmında detay soru çok ve zincirleme sorular oluyor: Dosbox stack/veri segment çıktısı ya da LST kodu verilip peş peşe ""boş yere ne gelir? Çıktı hangi hexadecimal sayı olur?"" tarzı sorular var, iyi çalışmazsanız hiçbirini yapamazsınız, birini yanlış yapınca hepsi yanlış gelir, notunuz yarıya iner. Labları yapay zekadan kopyala yapıştır yaparsanız da finalde zincirleme mikro sorularında çuvallarsınız.
Biraz yorucu olması haricinde çalışınca zevkli ve zorlamayan bir ders, ha siz yine de 4dk yapın videoyu."
25.01.2026 23:17:58,Veritabanı Yönetimi,InstructionPointer,"Bölümün en önemli derslerinden biri, PostreSQL ile veritabanı işleniyor, SQL tarafı kolay ve zevkli, sözel kısmı biraz sıkıcı ve ezber. Toplam 9 canlı ders tarzında uygulaması ve arada 2 quizi var, maalesef uygulamalar anlatan asistana bağlı aşırı yavaş ve sıkıcı bir formatta işlenebiliyor ve katılımı zorunlu, cuma akşamlarını zehir edebiliyor. Quizler tamamen uygulama ve SQL sorguları üzerine, ikincisi sebepsiz yere aşırı zordu. Final sınavı da aşırı kötüydü, sorular dersin ölçmesi gereken şeylerden çok uzak ve değişikti.
Bir de 3 kişilik projesi var, 1 aydan fazla süre veriliyor ve istenilen sistem örnekleri basit, kolaylıkla yaparsınız.
Dersi YT'den almanızı tavsiye ederim. Alamadıysanız zaten YT slaytları paylaşıyor, slaytları ders için en iyi kaynak. MUK'un dersine neredeyse kimse gelmiyor, tavsiye etmem.
Genel olarak güzel ve rahat bir ders, hiçbir sınav veya quizini salmayın çünkü soruların kalitesi her sınav değişiyor. Kaynaklar tam paylaşılıyor, harf notları düşük, böyle güzel 4 kredilik bir dersten yüksek not alma fırsatını kaçırmayın."
26.01.2026 12:04:06,Algoritma Analizi,Ayatollah,"Fena bir ders değil. Sınava 5–6 saat kala konulara bakmak, ilk 50 puanlık kısımdan puan almak için yeterli. Geri kalan 50 puan algoritmik sorulardan (flowchart, C kodu) oluşur, genel olarak geliştirilmesi gereken bir beceridir, Öğrenmesi bir gecede çok da mümkün değil. Hocalar cevabınızı beğenmezse çok puan kırar, adil hissettirmez. Ödev ve labları çok yormaz."
26.01.2026 12:34:11,Nesneye Yönelik Programlama,BilgisayarEnginarı,"Java üzerinden işlenir. İçeriği ve kapsamı güzel, geçmesi görece kolay, yüksek notla geçmek de mümkün olan biraz yoğun bir derstir. her uygulama dersinin ertesi haftası lab yapılarak yazılan koddan not verilir ve toplam 4 labı bulunur; bir adet çift kişilik projesi, birer vize ve final içeren bir sınav takvimi vardır. lablara tekrar yaparak gitmek mühimdir, iyi bir proje arkadaşı seçmelisiniz ve sınavlara güzelce çalışmalısınız. vizede kod yazdırılır, finali genellikle seçmeli olur ve kod yazma becerinizi değil, nesne yönetim becerinizi ve java hakkında ne kadar bilgi ezberleyebileceğinizi ölçer. YES yoklamayı önemsemez, anlatımını beğenmezseniz farklı bir hocanın dersine girme şansınız da var.
Başarılar."
26.01.2026 12:45:24,Ayrık Matematik,BilgisayarEnginarı,"İçeriği garip, konu kapsamı daha da garip, birkaç dersin karışımı gibi duran tuhaf bir yapıya sahiptir. Sabit bir konuda ilerlenmez ayrı ayrı şeyler anlatılır ve herhangi bir vize ve final nerdeyse birbirine benzemeyecek kadar çok konu barındırır. Ancak her biri basit ve kolay anlaşılabilir olduğundan, dersler düzenli bir şekilde takip edilir ve ara sıra tekrar edilirse hem geçmesi hem yüksek notla vermesi gayet mümkün olan bir derstir. harf notu konusunda banu hocada daha rahat edersiniz.
Başarılar "
